{
 "talk_id": "nasa_stgermain_cop26",
 "context": {
  "has_dataset": true,
  "has_images": true,
  "has_sources": false,
  "graph_ready": false,
  "has_map_data": true,
  "has_timeline_data": true
 },
 "metadata": {
  "source_uri": "https://svs.gsfc.nasa.gov/31168",
  "license": "NASA content generally not subject to copyright in the US; attribute NASA; do not imply endorsement (https://www.nasa.gov/nasa-brand-center/images-and-media/)",
  "rights_basis": "US-government work, NASA media usage guidelines",
  "domain": "earth science / climate",
  "language": "en",
  "pilot": true,
  "context_assumed": true,
  "independent_editors": false,
  "note": "Single LLM editor trace in oracle (full-future) mode; pilot only. Editor model/version to be recorded by repo owner."
 },
 "transcript": [
  {
   "start_s": 0.34,
   "end_s": 3.92,
   "text": "Hi, I’m Karen St. Germain and i am NASA's director of Earth Science."
  },
  {
   "start_s": 4.6,
   "end_s": 10.74,
   "text": "Often when people think of NASA, they think of human exploration or Planetary Exploration."
  },
  {
   "start_s": 10.74,
   "end_s": 19.98,
   "text": "They might not know that NASA has 23 satellites looking down at our Earth system to help us understand our home planet."
  },
  {
   "start_s": 21.84,
   "end_s": 30.42,
   "text": "We've been observing the Earth for decades, and we observe the atmosphere, the oceans, the land-  the entire Earth system!"
  },
  {
   "start_s": 30.76,
   "end_s": 34.62,
   "text": "I'm going to talk to you today about what we know from those observations."
  },
  {
   "start_s": 36.62,
   "end_s": 43.18,
   "text": "This is an example of the kind of sustained observation that NASA satellites make."
  },
  {
   "start_s": 43.18,
   "end_s": 64.62,
   "text": "Starting in 1993 until just our recent launch of the Sentinel 6 Michael Freilick satellite we've been observing directly measurements of sea level height and from those data we know the sea level has risen on average 90 mm just since the early 90s."
  },
  {
   "start_s": 65.2,
   "end_s": 67.14,
   "text": "But what's causing the sea level rise?"
  },
  {
   "start_s": 67.74,
   "end_s": 71.78,
   "text": "We all have heard about greenhouse gases and I'm going to talk to you today about two of them."
  },
  {
   "start_s": 71.98,
   "end_s": 73.78,
   "text": "The first one is carbon dioxide."
  },
  {
   "start_s": 73.78,
   "end_s": 83.4,
   "text": "Of course, carbon dioxide permeates our atmosphere. By just adjusting the color so I can emphasize the maximum areas of emission"
  },
  {
   "start_s": 83.52,
   "end_s": 91.08,
   "text": "I can show you where Carbon dioxide and when carbon dioxide is being emitted into our atmosphere."
  },
  {
   "start_s": 92.26,
   "end_s": 98.92,
   "text": "Carbon dioxide accumulates most during the north northern hemisphere winter months."
  },
  {
   "start_s": 99.22,
   "end_s": 109.86,
   "text": "Carbon dioxide is created by the burning of fossil fuels and that carbon dioxide accumulates in our atmosphere over the course of the winter"
  },
  {
   "start_s": 110.08,
   "end_s": 118.3,
   "text": "and it's only in the spring with the emergence of vegetation that it starts being removed from the atmosphere."
  },
  {
   "start_s": 120.2,
   "end_s": 130.72,
   "text": "Carbon dioxide left in the atmosphere lasts for a very long time and that's why there's so much conversation with carbon dioxide as one of the critical greenhouse gases."
  },
  {
   "start_s": 131.12,
   "end_s": 136.36,
   "text": "But on the next slide, I'll show you the other big greenhouse gas, Methane."
  },
  {
   "start_s": 136.76,
   "end_s": 149.62,
   "text": "So while carbon dioxide is produced from the burning of fossil fuels, methane is produced from the extraction of fossil fuels and also from agriculture and vegetation decay."
  },
  {
   "start_s": 150.62,
   "end_s": 155.94,
   "text": "Methane is about 20 times more potent a greenhouse gas than carbon dioxide,"
  },
  {
   "start_s": 156.12,
   "end_s": 162.04,
   "text": "but the good news is its lifetime in the atmosphere is much shorter, it lasts only around a decade."
  },
  {
   "start_s": 162.44,
   "end_s": 172.48,
   "text": "So when we talk about mitigation types of decisions, it really matters to understand where the greenhouse gases are coming from,"
  },
  {
   "start_s": 172.6,
   "end_s": 174.76,
   "text": "and how they play in the atmosphere."
  },
  {
   "start_s": 177.7,
   "end_s": 180.34,
   "text": "What do greenhouse gases do?"
  },
  {
   "start_s": 180.86,
   "end_s": 194.64,
   "text": "Well they trap a lot of the sun's energy in the earth system, and that is raising surface temperatures around the world over both land and ocean."
  },
  {
   "start_s": 195.6,
   "end_s": 205.1,
   "text": "We can estimate the total extra heat trapped in the Earth System since we started making satellite observations around the year 2000."
  },
  {
   "start_s": 208.86,
   "end_s": 210.78,
   "text": "Where does all that heat go?"
  },
  {
   "start_s": 211.26,
   "end_s": 216.84,
   "text": "Well, it turns out that today about 94% of it gets trapped in our oceans."
  },
  {
   "start_s": 217.4,
   "end_s": 219.9,
   "text": "Water has an enormous heat capacity."
  },
  {
   "start_s": 220.06,
   "end_s": 227.7,
   "text": "That means it absorbs a lot of heat before it's temperature goes up, and you know this if you've ever put a pot of water on the stove to boil."
  },
  {
   "start_s": 229.06,
   "end_s": 231.24,
   "text": "But that heat doesn't stay put."
  },
  {
   "start_s": 231.62,
   "end_s": 246.2,
   "text": "Our oceans are incredibly dynamic  with currents and eddies that carry that energy around the world and impact coastlines and in coastal communities weather patterns and more."
  },
  {
   "start_s": 246.2,
   "end_s": 251.4,
   "text": "I'll just talk to you about a few of the impact from the heat trapped in our oceans."
  },
  {
   "start_s": 252.92,
   "end_s": 255.62,
   "text": "One of those impacts is in the Arctic."
  },
  {
   "start_s": 255.64,
   "end_s": 267.14,
   "text": "You're looking down at Arctic sea ice. This is data from just this year showing you the extent of the Arctic sea ice. This is frozen ocean."
  },
  {
   "start_s": 268.04,
   "end_s": 275.54,
   "text": "Well over the course in the summer, of course that's sea ice starts to melt, and that extent shrinks"
  },
  {
   "start_s": 275.74,
   "end_s": 279.06,
   "text": "We've been looking at Arctic sea ice for decades now."
  },
  {
   "start_s": 279.2,
   "end_s": 285.06,
   "text": "We know that every year at the end of the summer there's less and less ice."
  },
  {
   "start_s": 286.32,
   "end_s": 287.56,
   "text": "Why does that matter?"
  },
  {
   "start_s": 288.58,
   "end_s": 291.08,
   "text": "Well ice is white!"
  },
  {
   "start_s": 291.12,
   "end_s": 305.62,
   "text": "It's one of the great reflectors of the sun's energy so in the summer months when the sun is beating down on the Northern Hemisphere the last ice we have less power we have to reflect the sun's energy back out into space."
  },
  {
   "start_s": 306.52,
   "end_s": 315.6,
   "text": "And this year, the summer minimum extend the substantially less than it has been in recent decades."
  },
  {
   "start_s": 318.26,
   "end_s": 327.78,
   "text": "Another way that the warming oceans affect the coastline is through the impact on land ice."
  },
  {
   "start_s": 328.06,
   "end_s": 344.92,
   "text": "So land Ice flows through glaciers to the oceans, and at that boundary that warm ocean can erode the underside of the glacier causing it to thin and eventually break off, and that is like a cork getting popped out of a bottle!"
  },
  {
   "start_s": 344.96,
   "end_s": 353.94,
   "text": "It increases the flow of ice from land out into the oceans and we know how much of that is happening."
  },
  {
   "start_s": 354.38,
   "end_s": 355.3,
   "text": "Next slide line please."
  },
  {
   "start_s": 356.12,
   "end_s": 359.86,
   "text": "The two biggest ice sheets are Antarctica and Greenland."
  },
  {
   "start_s": 360.38,
   "end_s": 372.24,
   "text": "We know where that ice is flowing from land out into the ocean, and that these two ice sheets alone contribute one-third of the total sea level rise that we observe."
  },
  {
   "start_s": 372.9,
   "end_s": 385.82,
   "text": "We know that in part because we make direct measurements of the mass of the ice on these ice sheets so we know how much mass has been lost from land transported into the oceans."
  },
  {
   "start_s": 389.22,
   "end_s": 392.26,
   "text": "So why do we care about sea level rise?"
  },
  {
   "start_s": 392.78,
   "end_s": 396.78,
   "text": "Well one of the reason is our coastal communities."
  },
  {
   "start_s": 396.78,
   "end_s": 406.76,
   "text": "We project a dramatic increase in just sunny day high tide flooding, when high tides ride on top of that sea level rise."
  },
  {
   "start_s": 408.12,
   "end_s": 409.18,
   "text": "But there's more."
  },
  {
   "start_s": 409.58,
   "end_s": 410.38,
   "text": "Next slide please."
  },
  {
   "start_s": 412.36,
   "end_s": 414.54,
   "text": "Our Earth is a water planet"
  },
  {
   "start_s": 415.44,
   "end_s": 421.38,
   "text": "And you might ask  “if I live inland, why does this matter to me?”"
  },
  {
   "start_s": 423.26,
   "end_s": 429.62,
   "text": "All of the water that we need to sustain life inland;  to grow crops, to drink."
  },
  {
   "start_s": 430.4,
   "end_s": 435.36,
   "text": "All of that water comes from the ocean, and it's delivered to us by the atmosphere."
  },
  {
   "start_s": 435.44,
   "end_s": 436.74,
   "text": "That's the water cycle."
  },
  {
   "start_s": 437.2,
   "end_s": 445.44,
   "text": "One of the things that were seen with climate change is an increase in the magnitude of that water cycle."
  },
  {
   "start_s": 446.58,